{
  "$schema": "../../schemas/task-state.schema.json",
  "schemaVersion": "1.0.0",
  "taskId": "V1-05",
  "revision": 4,
  "state": "planned",
  "attempt": 0,
  "candidate": null,
  "criteria": [
    {
      "criterionId": "CATALOG-001",
      "status": "pending",
      "evidenceRefs": []
    },
    {
      "criterionId": "CATALOG-002",
      "status": "pending",
      "evidenceRefs": []
    },
    {
      "criterionId": "CATALOG-003",
      "status": "pending",
      "evidenceRefs": []
    },
    {
      "criterionId": "CATALOG-004",
      "status": "pending",
      "evidenceRefs": []
    },
    {
      "criterionId": "CATALOG-005",
      "status": "pending",
      "evidenceRefs": []
    }
  ],
  "gates": [
    {
      "gateId": "QG-REPO-CHECK",
      "status": "pending",
      "evidenceRefs": []
    },
    {
      "gateId": "QG-CONTRACTS",
      "status": "pending",
      "evidenceRefs": []
    },
    {
      "gateId": "QG-SCENARIOS",
      "status": "pending",
      "evidenceRefs": []
    },
    {
      "gateId": "QG-INDEPENDENT-VERIFY",
      "status": "pending",
      "evidenceRefs": []
    }
  ],
  "reviews": [
    {
      "role": "maintainer",
      "status": "pending",
      "evidenceRefs": []
    }
  ],
  "blockers": [],
  "history": [
    {
      "from": null,
      "to": "planned",
      "at": "2026-08-10T00:30:00Z",
      "actor": "planning-agent",
      "reason": "Task created by the canonical OSS V1 plan."
    },
    {
      "from": "planned",
      "to": "planned",
      "at": "2026-08-10T11:56:03Z",
      "actor": "planning-agent",
      "reason": "Added bounded candidate-selection and catalog-refresh acceptance contracts."
    },
    {
      "from": "planned",
      "to": "planned",
      "at": "2026-08-10T12:19:11Z",
      "actor": "planning-agent",
      "reason": "Required immutable freshness observations when content-addressed snapshots are reused."
    },
    {
      "from": "planned",
      "to": "planned",
      "at": "2026-08-10T12:52:07Z",
      "actor": "planning-agent",
      "reason": "Locked cost, context, and canonical-ID ranking keys and directions for candidate selection."
    },
    {
      "from": "planned",
      "to": "planned",
      "at": "2026-08-10T13:14:22Z",
      "actor": "planning-agent",
      "reason": "Replaced unweighted price sums with representative workload-cost ranking."
    }
  ]
}
