{
  "$schema": "../../schemas/task-state.schema.json",
  "schemaVersion": "1.0.0",
  "taskId": "V1-06",
  "revision": 7,
  "state": "accepted",
  "attempt": 1,
  "candidate": {
    "baseCommit": "c78f99ab1fb75fcf98f752be4c27f02ff3ddaf98",
    "commit": "a47945e9a6d40eefe9adb3ff8feadb1624577c60",
    "executor": "implementation-agent"
  },
  "criteria": [
    {
      "criterionId": "EVAL-001",
      "status": "pass",
      "evidenceRefs": ["ev-v1-06-scenarios-a47945e"]
    },
    {
      "criterionId": "EVAL-002",
      "status": "pass",
      "evidenceRefs": ["ev-v1-06-contracts-a47945e"]
    },
    {
      "criterionId": "EVAL-003",
      "status": "pass",
      "evidenceRefs": ["ev-v1-06-scenarios-a47945e"]
    },
    {
      "criterionId": "EVAL-004",
      "status": "pass",
      "evidenceRefs": ["ev-v1-06-contracts-a47945e"]
    },
    {
      "criterionId": "EVAL-005",
      "status": "pass",
      "evidenceRefs": ["ev-v1-06-scenarios-a47945e"]
    },
    {
      "criterionId": "EVAL-006",
      "status": "pass",
      "evidenceRefs": ["ev-v1-06-contracts-a47945e"]
    },
    {
      "criterionId": "EVAL-007",
      "status": "pass",
      "evidenceRefs": ["ev-v1-06-contracts-a47945e"]
    }
  ],
  "gates": [
    {
      "gateId": "QG-REPO-CHECK",
      "status": "pass",
      "evidenceRefs": ["ev-v1-06-repo-check-a47945e"]
    },
    {
      "gateId": "QG-CONTRACTS",
      "status": "pass",
      "evidenceRefs": ["ev-v1-06-contracts-a47945e"]
    },
    {
      "gateId": "QG-SCENARIOS",
      "status": "pass",
      "evidenceRefs": ["ev-v1-06-scenarios-a47945e"]
    },
    {
      "gateId": "QG-INDEPENDENT-VERIFY",
      "status": "pending",
      "evidenceRefs": []
    },
    {
      "gateId": "QG-TRUST-REVIEW",
      "status": "pending",
      "evidenceRefs": []
    }
  ],
  "reviews": [
    {
      "role": "maintainer",
      "status": "pending",
      "evidenceRefs": []
    },
    {
      "role": "trust-reviewer",
      "status": "pending",
      "evidenceRefs": []
    }
  ],
  "blockers": [],
  "history": [
    {
      "from": null,
      "to": "planned",
      "at": "2026-08-10T00:30:00Z",
      "actor": "planning-agent",
      "reason": "Task created by the canonical OSS V1 plan."
    },
    {
      "from": "planned",
      "to": "planned",
      "at": "2026-08-12T10:04:24Z",
      "actor": "davidahmann",
      "reason": "Required explicit OpenRouter route-policy enforcement and complete router-attempt evidence before a provider-backed run can complete."
    },
    {
      "from": "planned",
      "to": "planned",
      "at": "2026-08-13T00:58:00Z",
      "actor": "davidahmann",
      "reason": "Required canonical runner-derived or authenticated execution times and made imported or caller-restamped evaluation evidence replay-only."
    },
    {
      "from": "planned",
      "to": "planned",
      "at": "2026-08-13T01:38:00Z",
      "actor": "davidahmann",
      "reason": "Required terminal catalog-refresh attempt lineage so a newer failure or omitted attempt cannot leave an older success actionable."
    },
    {
      "from": "planned",
      "to": "planned",
      "at": "2026-08-13T02:00:00Z",
      "actor": "davidahmann",
      "reason": "Preserved unchanged-input reuse through canonical content-addressed repository receipts while keeping arbitrary imports and caller-restamped evidence replay-only."
    },
    {
      "from": "planned",
      "to": "planned",
      "at": "2026-08-13T02:10:00Z",
      "actor": "davidahmann",
      "reason": "Added hash-chain and trusted anti-rollback proof for persisted reuse plus Changeset scope for the new public receipt contracts."
    },
    {
      "from": "planned",
      "to": "planned",
      "at": "2026-08-13T02:50:00Z",
      "actor": "davidahmann",
      "reason": "Defined recovery as a new externally anchored trust epoch that cannot rehabilitate prior unanchored receipts."
    },
    {
      "from": "planned",
      "to": "in_progress",
      "at": "2026-08-14T03:20:00Z",
      "actor": "implementation-agent",
      "reason": "Implemented the bounded offline evaluator, exact-head receipt store, and deterministic golden scenario within the compiled V1-06 packet."
    },
    {
      "from": "in_progress",
      "to": "verification_pending",
      "at": "2026-08-14T03:29:00Z",
      "actor": "implementation-agent",
      "reason": "Submitted the exact candidate after all active command gates and focused adversarial tests passed."
    },
    {
      "from": "verification_pending",
      "to": "accepted",
      "at": "2026-08-14T03:30:11Z",
      "actor": "davidahmann",
      "reason": "Maintainer accepted the exact candidate after command gates, independent verification, structured code review, and Vetryn trust review passed."
    }
  ]
}
