{
  "$schema": "../../schemas/task-state.schema.json",
  "schemaVersion": "1.0.0",
  "taskId": "V1-08",
  "revision": 2,
  "state": "planned",
  "attempt": 0,
  "candidate": null,
  "criteria": [
    {
      "criterionId": "PATCH-001",
      "status": "pending",
      "evidenceRefs": []
    },
    {
      "criterionId": "PATCH-002",
      "status": "pending",
      "evidenceRefs": []
    },
    {
      "criterionId": "PATCH-003",
      "status": "pending",
      "evidenceRefs": []
    },
    {
      "criterionId": "PATCH-004",
      "status": "pending",
      "evidenceRefs": []
    },
    {
      "criterionId": "PATCH-005",
      "status": "pending",
      "evidenceRefs": []
    }
  ],
  "gates": [
    {
      "gateId": "QG-REPO-CHECK",
      "status": "pending",
      "evidenceRefs": []
    },
    {
      "gateId": "QG-CONTRACTS",
      "status": "pending",
      "evidenceRefs": []
    },
    {
      "gateId": "QG-SCANNER-CORPUS",
      "status": "pending",
      "evidenceRefs": []
    },
    {
      "gateId": "QG-SCENARIOS",
      "status": "pending",
      "evidenceRefs": []
    },
    {
      "gateId": "QG-INDEPENDENT-VERIFY",
      "status": "pending",
      "evidenceRefs": []
    },
    {
      "gateId": "QG-TRUST-REVIEW",
      "status": "pending",
      "evidenceRefs": []
    }
  ],
  "reviews": [
    {
      "role": "maintainer",
      "status": "pending",
      "evidenceRefs": []
    },
    {
      "role": "trust-reviewer",
      "status": "pending",
      "evidenceRefs": []
    }
  ],
  "blockers": [],
  "history": [
    {
      "from": null,
      "to": "planned",
      "at": "2026-08-10T00:30:00Z",
      "actor": "planning-agent",
      "reason": "Task created by the canonical OSS V1 plan."
    },
    {
      "from": "planned",
      "to": "planned",
      "at": "2026-08-13T00:34:00Z",
      "actor": "davidahmann",
      "reason": "Required patch generation and application to reauthorize freshness and exact evidence identities at their own invocation time."
    },
    {
      "from": "planned",
      "to": "planned",
      "at": "2026-08-13T00:43:00Z",
      "actor": "davidahmann",
      "reason": "Extended patch reauthorization to current policy and profile digests, immutable fixture content, and successful catalog-refresh evidence without treating optional workload absence as a hard failure."
    }
  ]
}
