{
  "$schema": "../../schemas/task-state.schema.json",
  "schemaVersion": "1.0.0",
  "taskId": "M0-04",
  "revision": 1,
  "state": "in_progress",
  "attempt": 1,
  "candidate": null,
  "criteria": [
    {
      "criterionId": "PROCESS-005",
      "status": "pending",
      "evidenceRefs": []
    }
  ],
  "gates": [
    {
      "gateId": "QG-PLAN-CHECK",
      "status": "pending",
      "evidenceRefs": []
    },
    {
      "gateId": "QG-REPO-CHECK",
      "status": "pending",
      "evidenceRefs": []
    }
  ],
  "reviews": [],
  "blockers": [],
  "history": [
    {
      "from": null,
      "to": "planned",
      "at": "2026-08-11T03:49:07Z",
      "actor": "davidahmann",
      "reason": "Maintainer created the narrow process task required to authorize the two post-review V1-02 corrections."
    },
    {
      "from": "planned",
      "to": "in_progress",
      "at": "2026-08-11T03:52:21Z",
      "actor": "implementation-agent",
      "reason": "Started the single process-only authorization attempt before producing a fresh V1-02 candidate."
    }
  ]
}
