{
  "$schema": "../../schemas/task-state.schema.json",
  "schemaVersion": "1.0.0",
  "taskId": "V1-02",
  "revision": 5,
  "state": "verification_pending",
  "attempt": 3,
  "candidate": {
    "baseCommit": "99b1919bcb5a24394b1aa4ab5f0fdb003e0d1c30",
    "commit": "9ecc4cac5329e0f68522495d4ad47edaf89b4e83",
    "executor": "implementation-agent"
  },
  "criteria": [
    {
      "criterionId": "GOLDEN-001",
      "status": "pass",
      "evidenceRefs": ["ev-v1-02-scenarios-9ecc4ca"]
    },
    {
      "criterionId": "GOLDEN-002",
      "status": "pass",
      "evidenceRefs": ["ev-v1-02-scenarios-9ecc4ca"]
    },
    {
      "criterionId": "GOLDEN-003",
      "status": "pass",
      "evidenceRefs": ["ev-v1-02-scenarios-9ecc4ca"]
    },
    {
      "criterionId": "GOLDEN-004",
      "status": "pass",
      "evidenceRefs": ["ev-v1-02-scenarios-9ecc4ca"]
    }
  ],
  "gates": [
    {
      "gateId": "QG-REPO-CHECK",
      "status": "pass",
      "evidenceRefs": ["ev-v1-02-repo-check-9ecc4ca"]
    },
    {
      "gateId": "QG-SCENARIOS",
      "status": "pass",
      "evidenceRefs": ["ev-v1-02-scenarios-9ecc4ca"]
    },
    {
      "gateId": "QG-INDEPENDENT-VERIFY",
      "status": "pending",
      "evidenceRefs": []
    },
    {
      "gateId": "QG-TRUST-REVIEW",
      "status": "pending",
      "evidenceRefs": []
    }
  ],
  "reviews": [
    {
      "role": "maintainer",
      "status": "pending",
      "evidenceRefs": []
    },
    {
      "role": "trust-reviewer",
      "status": "pending",
      "evidenceRefs": []
    }
  ],
  "blockers": [],
  "history": [
    {
      "from": null,
      "to": "planned",
      "at": "2026-08-10T00:30:00Z",
      "actor": "planning-agent",
      "reason": "Task created by the canonical OSS V1 plan."
    },
    {
      "from": "planned",
      "to": "in_progress",
      "at": "2026-08-11T01:30:00Z",
      "actor": "davidahmann",
      "reason": "Started the first original implementation attempt before producing a pull-request candidate."
    },
    {
      "from": "in_progress",
      "to": "verification_pending",
      "at": "2026-08-11T01:44:00Z",
      "actor": "davidahmann",
      "reason": "Submitted the first original candidate for command and review verification."
    },
    {
      "from": "verification_pending",
      "to": "changes_requested",
      "at": "2026-08-11T01:45:20Z",
      "actor": "davidahmann",
      "reason": "First pull-request candidate was returned for concrete review corrections before canonical acceptance."
    },
    {
      "from": "changes_requested",
      "to": "in_progress",
      "at": "2026-08-11T01:46:00Z",
      "actor": "davidahmann",
      "reason": "Started the second original implementation attempt to address the first review corrections."
    },
    {
      "from": "in_progress",
      "to": "verification_pending",
      "at": "2026-08-11T01:56:00Z",
      "actor": "davidahmann",
      "reason": "Submitted the second original candidate for command and review verification."
    },
    {
      "from": "verification_pending",
      "to": "changes_requested",
      "at": "2026-08-11T01:57:19Z",
      "actor": "davidahmann",
      "reason": "Second pull-request candidate exhausted the original two-attempt budget with further concrete review corrections; no V1-02 candidate was accepted."
    },
    {
      "from": "changes_requested",
      "to": "planned",
      "at": "2026-08-11T01:57:20Z",
      "actor": "davidahmann",
      "reason": "Returned to planning after the original attempt budget was exhausted; any further attempt requires a separate accepted authorization task."
    },
    {
      "from": "planned",
      "to": "in_progress",
      "at": "2026-08-11T02:41:40Z",
      "actor": "davidahmann",
      "reason": "Maintainer started the single M0-03-authorized final implementation attempt before creating a new candidate."
    },
    {
      "from": "in_progress",
      "to": "accepted",
      "at": "2026-08-11T02:45:01Z",
      "actor": "davidahmann",
      "reason": "Maintainer accepted the exact deterministic golden-repository candidate after both active command gates passed; named review records remain advisory under ADR 0009."
    },
    {
      "from": "accepted",
      "to": "in_progress",
      "at": "2026-08-11T03:39:39Z",
      "actor": "implementation-agent",
      "reason": "Reopened the still-unmerged golden-scenario task so the P1-required independent maintainer promotion can follow a new exact candidate."
    },
    {
      "from": "in_progress",
      "to": "verification_pending",
      "at": "2026-08-11T03:40:55Z",
      "actor": "implementation-agent",
      "reason": "Submitted the exact P1/P2 corrective candidate with compact command evidence for independent maintainer promotion."
    }
  ]
}
