{
  "$schema": "../../schemas/task-state.schema.json",
  "schemaVersion": "1.0.0",
  "taskId": "V1-10",
  "revision": 1,
  "state": "planned",
  "attempt": 0,
  "candidate": null,
  "criteria": [
    {
      "criterionId": "FIELD-001",
      "status": "pending",
      "evidenceRefs": []
    },
    {
      "criterionId": "FIELD-002",
      "status": "pending",
      "evidenceRefs": []
    },
    {
      "criterionId": "FIELD-003",
      "status": "pending",
      "evidenceRefs": []
    },
    {
      "criterionId": "FIELD-004",
      "status": "pending",
      "evidenceRefs": []
    },
    {
      "criterionId": "FIELD-005",
      "status": "pending",
      "evidenceRefs": []
    }
  ],
  "gates": [
    {
      "gateId": "QG-FIELD",
      "status": "pending",
      "evidenceRefs": []
    },
    {
      "gateId": "QG-INDEPENDENT-VERIFY",
      "status": "pending",
      "evidenceRefs": []
    },
    {
      "gateId": "QG-TRUST-REVIEW",
      "status": "pending",
      "evidenceRefs": []
    }
  ],
  "reviews": [
    {
      "role": "maintainer",
      "status": "pending",
      "evidenceRefs": []
    },
    {
      "role": "trust-reviewer",
      "status": "pending",
      "evidenceRefs": []
    }
  ],
  "blockers": [],
  "history": [
    {
      "from": null,
      "to": "planned",
      "at": "2026-08-10T00:30:00Z",
      "actor": "planning-agent",
      "reason": "Task created by the canonical OSS V1 plan."
    },
    {
      "from": "planned",
      "to": "planned",
      "at": "2026-08-10T12:19:11Z",
      "actor": "planning-agent",
      "reason": "Added sanitized field evidence for valuable open-ended call sites blocked by deterministic evaluation."
    }
  ]
}
