{
  "$schema": "../../schemas/task-state.schema.json",
  "schemaVersion": "1.0.0",
  "taskId": "V1-00",
  "revision": 6,
  "state": "accepted",
  "attempt": 1,
  "candidate": {
    "baseCommit": "8c5bd603c0271061cce21372abc353ab52bef882",
    "commit": "1d5a7813f0226c4a347a510fc32f3e167ae23354",
    "executor": "davidahmann"
  },
  "criteria": [
    {
      "criterionId": "PLAN-001",
      "status": "pass",
      "evidenceRefs": ["ev-v1-00-independent-review-1d5a781"]
    },
    {
      "criterionId": "PLAN-002",
      "status": "pass",
      "evidenceRefs": ["ev-v1-00-plan-check-1d5a781"]
    },
    {
      "criterionId": "PLAN-003",
      "status": "pass",
      "evidenceRefs": ["ev-v1-00-trust-review-1d5a781"]
    },
    {
      "criterionId": "PLAN-004",
      "status": "pass",
      "evidenceRefs": ["ev-v1-00-repo-check-1d5a781"]
    }
  ],
  "gates": [
    {
      "gateId": "QG-PLAN-CHECK",
      "status": "pass",
      "evidenceRefs": ["ev-v1-00-plan-check-1d5a781"]
    },
    {
      "gateId": "QG-REPO-CHECK",
      "status": "pass",
      "evidenceRefs": ["ev-v1-00-repo-check-1d5a781"]
    },
    {
      "gateId": "QG-INDEPENDENT-VERIFY",
      "status": "pass",
      "evidenceRefs": ["ev-v1-00-independent-review-1d5a781"]
    },
    {
      "gateId": "QG-TRUST-REVIEW",
      "status": "pass",
      "evidenceRefs": ["ev-v1-00-trust-review-1d5a781"]
    }
  ],
  "reviews": [
    {
      "role": "maintainer",
      "status": "approved",
      "evidenceRefs": ["ev-v1-00-maintainer-review-1d5a781"]
    },
    {
      "role": "trust-reviewer",
      "status": "approved",
      "evidenceRefs": ["ev-v1-00-trust-review-1d5a781"]
    }
  ],
  "blockers": [],
  "history": [
    {
      "from": null,
      "to": "in_progress",
      "at": "2026-08-10T00:30:00Z",
      "actor": "planning-agent",
      "reason": "Planning-only task authorized by the maintainer."
    },
    {
      "from": "in_progress",
      "to": "in_progress",
      "at": "2026-08-10T14:10:00Z",
      "actor": "planning-contract-repair-agent",
      "reason": "Recompiled the task packet after reconciling historical planning-test scope and adding the explicit runner-ready contract; acceptance remains pending."
    },
    {
      "from": "in_progress",
      "to": "in_progress",
      "at": "2026-08-10T14:45:00Z",
      "actor": "planning-contract-repair-agent",
      "reason": "Recompiled the review contract for the authenticated ADR-0006 bootstrap owner-comment path; candidate, acceptance, gates, and reviews remain pending."
    },
    {
      "from": "in_progress",
      "to": "in_progress",
      "at": "2026-08-10T14:55:00Z",
      "actor": "planning-contract-repair-agent",
      "reason": "Aligned the bootstrap review contract with GitHub's OWNER-or-MEMBER association semantics for organization repositories; candidate, acceptance, gates, and reviews remain pending."
    },
    {
      "from": "in_progress",
      "to": "in_progress",
      "at": "2026-08-10T15:13:00Z",
      "actor": "planning-contract-repair-agent",
      "reason": "Made protected-main CODEOWNERS authoritative for bootstrap roles while retaining the anonymous public association as exact provenance; candidate, acceptance, gates, and reviews remain pending."
    },
    {
      "from": "in_progress",
      "to": "accepted",
      "at": "2026-08-10T15:20:00Z",
      "actor": "davidahmann",
      "reason": "Promoted the independently verified exact candidate after both command gates passed and the authenticated protected-main CODEOWNER comment authorized every required review role."
    }
  ]
}
