{
  "$schema": "../../schemas/task-state.schema.json",
  "schemaVersion": "1.0.0",
  "taskId": "M0-07",
  "revision": 22,
  "state": "in_progress",
  "attempt": 3,
  "candidate": null,
  "criteria": [
    {
      "criterionId": "PROCESS-008",
      "status": "pending",
      "evidenceRefs": []
    }
  ],
  "gates": [
    {
      "gateId": "QG-PLAN-CHECK",
      "status": "pending",
      "evidenceRefs": []
    },
    {
      "gateId": "QG-REPO-CHECK",
      "status": "pending",
      "evidenceRefs": []
    }
  ],
  "reviews": [],
  "blockers": [],
  "history": [
    {
      "from": null,
      "to": "planned",
      "at": "2026-08-11T17:30:00Z",
      "actor": "davidahmann",
      "reason": "Maintainer authorized the narrow process correction required for a clean V1-05 workspace package and release record."
    },
    {
      "from": "planned",
      "to": "in_progress",
      "at": "2026-08-11T17:31:00Z",
      "actor": "implementation-agent",
      "reason": "Started the process-only correction before adding any V1-05 product code."
    },
    {
      "from": "in_progress",
      "to": "in_progress",
      "at": "2026-08-11T17:32:00Z",
      "actor": "implementation-agent",
      "reason": "Added the missing deterministic lifecycle artifact refs required by Factory's frozen-candidate review preflight."
    },
    {
      "from": "in_progress",
      "to": "accepted",
      "at": "2026-08-11T17:34:45Z",
      "actor": "davidahmann",
      "reason": "Maintainer accepted the exact M0-07 candidate after both active command gates passed and the correction remained process-only."
    },
    {
      "from": "accepted",
      "to": "in_progress",
      "at": "2026-08-11T17:41:00Z",
      "actor": "implementation-agent",
      "reason": "Reopened the still-unmerged process task to address current-head Codex findings about immutable candidate refs and task-derived package documentation."
    },
    {
      "from": "in_progress",
      "to": "accepted",
      "at": "2026-08-11T17:43:26Z",
      "actor": "davidahmann",
      "reason": "Maintainer accepted the exact repaired candidate after both current-head review findings were covered by deterministic tests and all active gates passed."
    },
    {
      "from": "accepted",
      "to": "in_progress",
      "at": "2026-08-11T17:49:44Z",
      "actor": "implementation-agent",
      "reason": "Reopened the still-unmerged task for cross-field packet validation after current-head review showed schema shape alone could not bind lifecycle refs."
    },
    {
      "from": "in_progress",
      "to": "accepted",
      "at": "2026-08-11T17:51:47Z",
      "actor": "davidahmann",
      "reason": "Maintainer accepted the exact final candidate after adversarial cross-field validation covered wrong-task, stale-candidate, unbound, swapped-artifact, and forged-candidate cases."
    },
    {
      "from": "accepted",
      "to": "in_progress",
      "at": "2026-08-11T17:57:07Z",
      "actor": "implementation-agent",
      "reason": "Continued the third still-unmerged correction attempt to authenticate stored packets against canonical plan policy and make packet-path substitution machine-readable."
    },
    {
      "from": "in_progress",
      "to": "accepted",
      "at": "2026-08-11T18:00:20Z",
      "actor": "davidahmann",
      "reason": "Maintainer accepted the exact canonical-authentication candidate after deterministic policy-downgrade, stale-plan, promotion-tail, candidate, task, and artifact-binding tests passed."
    },
    {
      "from": "accepted",
      "to": "in_progress",
      "at": "2026-08-11T18:06:32Z",
      "actor": "implementation-agent",
      "reason": "Continued the same third review-correction attempt to authenticate every runner-consumed executor evidence and acceptance-closure field."
    },
    {
      "from": "in_progress",
      "to": "accepted",
      "at": "2026-08-11T18:09:56Z",
      "actor": "davidahmann",
      "reason": "Maintainer accepted the full-surface authentication candidate after deterministic executor-evidence, acceptance-closure, policy-downgrade, stale-plan, promotion-tail, and binding tests passed."
    },
    {
      "from": "accepted",
      "to": "in_progress",
      "at": "2026-08-11T18:17:04Z",
      "actor": "implementation-agent",
      "reason": "Continued the same third review-correction attempt to authenticate all remaining policy-bearing packet fields rather than extending a manual partial allowlist."
    },
    {
      "from": "in_progress",
      "to": "accepted",
      "at": "2026-08-11T18:20:40Z",
      "actor": "davidahmann",
      "reason": "Maintainer accepted the exact complete-policy-authentication candidate after adversarial acceptance, scanner, CI, release, documentation, source-metadata, stale-input, and lifecycle-binding tests and both active command gates passed."
    },
    {
      "from": "accepted",
      "to": "in_progress",
      "at": "2026-08-11T18:27:00Z",
      "actor": "implementation-agent",
      "reason": "Continued the same third review-correction attempt to reject unbound lifecycle preflight, authenticate packet identity, and make canonical object comparison insensitive to JSON member order."
    },
    {
      "from": "in_progress",
      "to": "accepted",
      "at": "2026-08-11T18:29:40Z",
      "actor": "davidahmann",
      "reason": "Maintainer accepted the exact lifecycle-preflight boundary candidate after bound/unbound, packet-identity, order-insensitive structural comparison, policy-authentication, and full repository gates passed."
    },
    {
      "from": "accepted",
      "to": "in_progress",
      "at": "2026-08-11T18:36:30Z",
      "actor": "implementation-agent",
      "reason": "Continued the same third review-correction attempt so lifecycle preflight validates canonical plan and ledger inputs before deriving trusted packet policy."
    },
    {
      "from": "in_progress",
      "to": "accepted",
      "at": "2026-08-11T18:38:09Z",
      "actor": "davidahmann",
      "reason": "Maintainer accepted the exact canonical-input-validation candidate after malformed-plan, bound/unbound, packet-identity, structural-comparison, and full repository gates passed."
    },
    {
      "from": "accepted",
      "to": "in_progress",
      "at": "2026-08-11T18:41:30Z",
      "actor": "implementation-agent",
      "reason": "Continued the same third review-correction attempt to give the expanded adversarial packet test a bounded Linux CI timeout matching its measured subprocess workload."
    },
    {
      "from": "in_progress",
      "to": "accepted",
      "at": "2026-08-11T18:42:06Z",
      "actor": "davidahmann",
      "reason": "Maintainer accepted the exact bounded-timeout candidate after the focused suite and full repository gate completed within the new explicit test budget."
    },
    {
      "from": "accepted",
      "to": "in_progress",
      "at": "2026-08-11T18:48:00Z",
      "actor": "implementation-agent",
      "reason": "Continued the same third review-correction attempt to authenticate acceptance promotion tails, remove unauthenticated lifecycle-mutable digest claims, and compare digest keys without member-order sensitivity."
    },
    {
      "from": "in_progress",
      "to": "accepted",
      "at": "2026-08-11T18:50:59Z",
      "actor": "davidahmann",
      "reason": "Maintainer accepted the exact promotion-provenance candidate after fabricated-tail, forged-mutable-digest, reordered-digest-map, canonical-input, and full repository gates passed."
    },
    {
      "from": "accepted",
      "to": "in_progress",
      "at": "2026-08-11T18:56:30Z",
      "actor": "implementation-agent",
      "reason": "Continued the same third review-correction attempt to bind immutable source digests to both the frozen Git candidate and current checkout."
    }
  ]
}
