{
  "$schema": "../../schemas/task-state.schema.json",
  "schemaVersion": "1.0.0",
  "taskId": "M0-03",
  "revision": 10,
  "state": "accepted",
  "attempt": 1,
  "candidate": {
    "baseCommit": "ebb19dd41abeb97934d6b147f7292eb01cf3de96",
    "commit": "61d54182c3406ff87559db54b7ad833a510f822e",
    "executor": "davidahmann"
  },
  "criteria": [
    {
      "criterionId": "PROCESS-004",
      "status": "pass",
      "evidenceRefs": ["ev-m0-03-repo-check-61d5418"]
    }
  ],
  "gates": [
    {
      "gateId": "QG-PLAN-CHECK",
      "status": "pass",
      "evidenceRefs": ["ev-m0-03-plan-check-61d5418"]
    },
    {
      "gateId": "QG-REPO-CHECK",
      "status": "pass",
      "evidenceRefs": ["ev-m0-03-repo-check-61d5418"]
    }
  ],
  "reviews": [],
  "blockers": [],
  "history": [
    {
      "from": null,
      "to": "planned",
      "at": "2026-08-11T02:15:00Z",
      "actor": "davidahmann",
      "reason": "Maintainer created the separate process task required to reauthorize the unresolved V1-02 review-correction attempt."
    },
    {
      "from": "planned",
      "to": "in_progress",
      "at": "2026-08-11T02:15:00Z",
      "actor": "davidahmann",
      "reason": "Started the plan-only reauthorization before any fresh V1-02 candidate is created."
    },
    {
      "from": "in_progress",
      "to": "accepted",
      "at": "2026-08-11T02:36:34Z",
      "actor": "davidahmann",
      "reason": "Maintainer accepted the exact plan-only authorization candidate after the active plan and repository command gates passed."
    },
    {
      "from": "accepted",
      "to": "in_progress",
      "at": "2026-08-11T02:52:00Z",
      "actor": "davidahmann",
      "reason": "Reopened the still-unmerged authorization for concrete Codex corrections within the already-authorized single M0-03 attempt."
    },
    {
      "from": "in_progress",
      "to": "accepted",
      "at": "2026-08-11T02:52:35Z",
      "actor": "davidahmann",
      "reason": "Maintainer accepted the corrected exact M0-03 candidate after both active command gates passed."
    },
    {
      "from": "accepted",
      "to": "in_progress",
      "at": "2026-08-11T02:57:40Z",
      "actor": "davidahmann",
      "reason": "Reopened the still-unmerged authorization for the final gate-evidence binding correction within the already-authorized single M0-03 attempt."
    },
    {
      "from": "in_progress",
      "to": "accepted",
      "at": "2026-08-11T02:59:09Z",
      "actor": "davidahmann",
      "reason": "Maintainer accepted the final exact M0-03 corrective candidate after both active command gates passed."
    },
    {
      "from": "accepted",
      "to": "in_progress",
      "at": "2026-08-11T03:11:21Z",
      "actor": "davidahmann",
      "reason": "Reopened the still-unmerged authorization to bind each of the five reviewed correction IDs to its exact remedy text."
    },
    {
      "from": "in_progress",
      "to": "accepted",
      "at": "2026-08-11T03:12:06Z",
      "actor": "davidahmann",
      "reason": "Maintainer accepted the exact M0-03 candidate after the five authorized correction IDs and remedies passed the repository command gate."
    },
    {
      "from": "accepted",
      "to": "in_progress",
      "at": "2026-08-11T03:22:09Z",
      "actor": "davidahmann",
      "reason": "Reopened the still-unmerged authorization to close the two latest-head P2 reauthorization-boundary test gaps without changing product scope."
    },
    {
      "from": "in_progress",
      "to": "accepted",
      "at": "2026-08-11T03:24:00Z",
      "actor": "davidahmann",
      "reason": "Maintainer accepted the exact M0-03 candidate after the complete authorized-invariant set and active-attempt boundary mutations passed both command gates."
    }
  ]
}
