{
  "$schema": "../../schemas/task-state.schema.json",
  "schemaVersion": "1.0.0",
  "taskId": "V1-03",
  "revision": 19,
  "state": "in_progress",
  "attempt": 3,
  "candidate": null,
  "criteria": [
    {
      "criterionId": "SCAN-001",
      "status": "pending",
      "evidenceRefs": []
    },
    {
      "criterionId": "SCAN-002",
      "status": "pending",
      "evidenceRefs": []
    },
    {
      "criterionId": "SCAN-003",
      "status": "pending",
      "evidenceRefs": []
    },
    {
      "criterionId": "SCAN-004",
      "status": "pending",
      "evidenceRefs": []
    }
  ],
  "gates": [
    {
      "gateId": "QG-REPO-CHECK",
      "status": "pending",
      "evidenceRefs": []
    },
    {
      "gateId": "QG-CONTRACTS",
      "status": "pending",
      "evidenceRefs": []
    },
    {
      "gateId": "QG-SCANNER-CORPUS",
      "status": "pending",
      "evidenceRefs": []
    },
    {
      "gateId": "QG-INDEPENDENT-VERIFY",
      "status": "pending",
      "evidenceRefs": []
    },
    {
      "gateId": "QG-TRUST-REVIEW",
      "status": "pending",
      "evidenceRefs": []
    }
  ],
  "reviews": [
    {
      "role": "maintainer",
      "status": "pending",
      "evidenceRefs": []
    },
    {
      "role": "trust-reviewer",
      "status": "pending",
      "evidenceRefs": []
    }
  ],
  "blockers": [],
  "history": [
    {
      "from": null,
      "to": "planned",
      "at": "2026-08-10T00:30:00Z",
      "actor": "planning-agent",
      "reason": "Task created by the canonical OSS V1 plan."
    },
    {
      "from": "planned",
      "to": "in_progress",
      "at": "2026-08-11T05:00:00Z",
      "actor": "implementation-agent",
      "reason": "Started the first high-confidence TypeScript scanner attempt with a narrow workspace, manifest-concurrency, and release-metadata scope amendment."
    },
    {
      "from": "in_progress",
      "to": "verification_pending",
      "at": "2026-08-11T09:47:56Z",
      "actor": "implementation-agent",
      "reason": "Submitted the exact scanner candidate with repository, contract, and reviewed-corpus command evidence for maintainer promotion."
    },
    {
      "from": "verification_pending",
      "to": "accepted",
      "at": "2026-08-11T09:49:00Z",
      "actor": "davidahmann",
      "reason": "Maintainer accepted the exact scanner candidate after all active command gates passed; named review records remain advisory under ADR 0009."
    },
    {
      "from": "accepted",
      "to": "changes_requested",
      "at": "2026-08-11T10:03:43Z",
      "actor": "chatgpt-codex-connector[bot]",
      "reason": "P1 review feedback found that same-text identifiers could bypass verified OpenAI client provenance; the scope authorization was separately merged in PR #17."
    },
    {
      "from": "changes_requested",
      "to": "in_progress",
      "at": "2026-08-11T10:03:43Z",
      "actor": "implementation-agent",
      "reason": "Started the permitted second attempt to bind client provenance to lexical declaration symbols."
    },
    {
      "from": "in_progress",
      "to": "verification_pending",
      "at": "2026-08-11T10:06:03Z",
      "actor": "implementation-agent",
      "reason": "Submitted the exact lexical-binding repair candidate with replacement repository, contract, and scanner-corpus command evidence."
    },
    {
      "from": "verification_pending",
      "to": "accepted",
      "at": "2026-08-11T10:07:12Z",
      "actor": "davidahmann",
      "reason": "Maintainer accepted the exact repaired scanner candidate after all active command gates passed; reviewer records remain advisory under ADR 0009."
    },
    {
      "from": "accepted",
      "to": "changes_requested",
      "at": "2026-08-11T10:23:32Z",
      "actor": "chatgpt-codex-connector[bot]",
      "reason": "Post-merge P1 feedback found two remaining unsafe patchability paths: computed properties can override a literal model field and mutable client bindings can lose SDK provenance."
    },
    {
      "from": "changes_requested",
      "to": "in_progress",
      "at": "2026-08-11T10:23:32Z",
      "actor": "davidahmann",
      "reason": "Maintainer reopened the final safety-correction attempt under the abstention-only invariant."
    },
    {
      "from": "in_progress",
      "to": "verification_pending",
      "at": "2026-08-11T10:37:08Z",
      "actor": "implementation-agent",
      "reason": "Submitted the exact computed-override and mutable-binding safety repair candidate with replacement repository, contract, and scanner-corpus command evidence."
    },
    {
      "from": "verification_pending",
      "to": "accepted",
      "at": "2026-08-11T10:38:10Z",
      "actor": "davidahmann",
      "reason": "Maintainer accepted the exact final scanner safety candidate after all active command gates passed; reviewer records remain advisory under ADR 0009."
    },
    {
      "from": "accepted",
      "to": "changes_requested",
      "at": "2026-08-11T10:44:31Z",
      "actor": "chatgpt-codex-connector[bot]",
      "reason": "P1 review feedback found that source order cannot prove a receiver was not reassigned by hoisted or deferred control flow."
    },
    {
      "from": "changes_requested",
      "to": "in_progress",
      "at": "2026-08-11T10:44:31Z",
      "actor": "davidahmann",
      "reason": "Maintainer reopened the same unmerged final safety attempt to make all reassigned proven receivers abstain."
    },
    {
      "from": "in_progress",
      "to": "verification_pending",
      "at": "2026-08-11T10:47:21Z",
      "actor": "implementation-agent",
      "reason": "Submitted the exact hoisted-control-flow safety repair candidate with replacement repository, contract, and scanner-corpus command evidence."
    },
    {
      "from": "verification_pending",
      "to": "accepted",
      "at": "2026-08-11T10:49:18Z",
      "actor": "davidahmann",
      "reason": "Maintainer accepted the exact scanner safety candidate after all active command gates passed; reviewer records remain advisory under ADR 0009."
    },
    {
      "from": "accepted",
      "to": "changes_requested",
      "at": "2026-08-11T10:53:24Z",
      "actor": "chatgpt-codex-connector[bot]",
      "reason": "P1 review feedback found that compound receiver assignments can also replace a proven OpenAI client before a patchable call."
    },
    {
      "from": "changes_requested",
      "to": "in_progress",
      "at": "2026-08-11T10:53:24Z",
      "actor": "davidahmann",
      "reason": "Maintainer reopened the same unmerged final safety attempt to make all assignment operators on proven receivers abstain."
    },
    {
      "from": "in_progress",
      "to": "verification_pending",
      "at": "2026-08-11T10:56:29Z",
      "actor": "implementation-agent",
      "reason": "Submitted the exact compound-assignment safety repair candidate with replacement repository, contract, and scanner-corpus command evidence."
    },
    {
      "from": "verification_pending",
      "to": "accepted",
      "at": "2026-08-11T10:57:54Z",
      "actor": "davidahmann",
      "reason": "Maintainer accepted the exact scanner safety candidate after all active command gates passed; reviewer records remain advisory under ADR 0009."
    },
    {
      "from": "accepted",
      "to": "changes_requested",
      "at": "2026-08-11T11:02:06Z",
      "actor": "chatgpt-codex-connector[bot]",
      "reason": "P1 review feedback found that destructuring assignment targets can replace a proven OpenAI receiver before a patchable call."
    },
    {
      "from": "changes_requested",
      "to": "in_progress",
      "at": "2026-08-11T11:02:06Z",
      "actor": "davidahmann",
      "reason": "Maintainer reopened the same unmerged final safety attempt to make all direct receiver write targets abstain."
    },
    {
      "from": "in_progress",
      "to": "verification_pending",
      "at": "2026-08-11T11:05:14Z",
      "actor": "implementation-agent",
      "reason": "Submitted the exact receiver-write-target safety repair candidate with replacement repository, contract, and scanner-corpus command evidence."
    },
    {
      "from": "verification_pending",
      "to": "accepted",
      "at": "2026-08-11T11:06:33Z",
      "actor": "davidahmann",
      "reason": "Maintainer accepted the exact scanner safety candidate after all active command gates passed; reviewer records remain advisory under ADR 0009."
    },
    {
      "from": "accepted",
      "to": "changes_requested",
      "at": "2026-08-11T11:10:20Z",
      "actor": "chatgpt-codex-connector[bot]",
      "reason": "P1 review feedback found that direct eval can mutate a proven receiver without a statically visible write target."
    },
    {
      "from": "changes_requested",
      "to": "in_progress",
      "at": "2026-08-11T11:10:20Z",
      "actor": "davidahmann",
      "reason": "Maintainer reopened the same unmerged final safety attempt to make direct eval fail closed for proven receiver provenance."
    }
  ]
}
