{
  "$schema": "../../schemas/task-state.schema.json",
  "schemaVersion": "1.0.0",
  "taskId": "M0-02",
  "revision": 6,
  "state": "accepted",
  "attempt": 3,
  "candidate": {
    "baseCommit": "5322bdfce5304b1e178c45875d04659b93adcc78",
    "commit": "35e330b3238c019495be2a448fcfa354e2293801",
    "executor": "davidahmann"
  },
  "criteria": [
    {
      "criterionId": "PROCESS-003",
      "status": "pass",
      "evidenceRefs": ["ev-m0-02-repo-check-35e330b"]
    }
  ],
  "gates": [
    {
      "gateId": "QG-PLAN-CHECK",
      "status": "pass",
      "evidenceRefs": ["ev-m0-02-plan-check-35e330b"]
    },
    {
      "gateId": "QG-REPO-CHECK",
      "status": "pass",
      "evidenceRefs": ["ev-m0-02-repo-check-35e330b"]
    }
  ],
  "reviews": [],
  "blockers": [],
  "history": [
    {
      "from": null,
      "to": "planned",
      "at": "2026-08-11T00:45:09Z",
      "actor": "davidahmann",
      "reason": "Maintainer created the narrow process task required by the V1-02 skill activation rule."
    },
    {
      "from": "planned",
      "to": "in_progress",
      "at": "2026-08-11T00:45:09Z",
      "actor": "davidahmann",
      "reason": "Started the separately scoped golden-scenario skill before V1-02 implementation."
    },
    {
      "from": "in_progress",
      "to": "accepted",
      "at": "2026-08-11T00:53:34Z",
      "actor": "davidahmann",
      "reason": "Maintainer accepted the exact golden-scenario skill candidate after active planning and repository command gates passed."
    },
    {
      "from": "accepted",
      "to": "in_progress",
      "at": "2026-08-11T01:01:30Z",
      "actor": "davidahmann",
      "reason": "Reopened M0-02 to bind concrete Codex review repairs to a fresh exact candidate."
    },
    {
      "from": "in_progress",
      "to": "accepted",
      "at": "2026-08-11T01:01:53Z",
      "actor": "davidahmann",
      "reason": "Maintainer accepted the exact review-repair candidate after active planning and repository command gates passed."
    },
    {
      "from": "accepted",
      "to": "in_progress",
      "at": "2026-08-11T01:09:10Z",
      "actor": "davidahmann",
      "reason": "Reopened M0-02 for its final deterministic skill-contract evidence and attempt accounting repair."
    },
    {
      "from": "in_progress",
      "to": "accepted",
      "at": "2026-08-11T01:10:32Z",
      "actor": "davidahmann",
      "reason": "Maintainer accepted the final skill-contract candidate after active planning and repository command gates passed."
    }
  ]
}
