{
  "$schema": "../../schemas/task-state.schema.json",
  "schemaVersion": "1.0.0",
  "taskId": "M0-10",
  "revision": 2,
  "state": "accepted",
  "attempt": 1,
  "candidate": {
    "baseCommit": "0a43e3249cbc5cc1419841b4051c955246a24b71",
    "commit": "d8984eb30c59371f65f9b08b2066067e1dd16101",
    "executor": "implementation-agent"
  },
  "criteria": [
    {
      "criterionId": "ROUTE-004",
      "status": "pass",
      "evidenceRefs": ["ev-m0-10-contracts-d8984eb"]
    },
    {
      "criterionId": "RECON-002",
      "status": "pass",
      "evidenceRefs": ["ev-m0-10-repo-check-d8984eb"]
    }
  ],
  "gates": [
    {
      "gateId": "QG-PLAN-CHECK",
      "status": "pass",
      "evidenceRefs": ["ev-m0-10-plan-check-d8984eb"]
    },
    {
      "gateId": "QG-REPO-CHECK",
      "status": "pass",
      "evidenceRefs": ["ev-m0-10-repo-check-d8984eb"]
    },
    {
      "gateId": "QG-CONTRACTS",
      "status": "pass",
      "evidenceRefs": ["ev-m0-10-contracts-d8984eb"]
    },
    { "gateId": "QG-INDEPENDENT-VERIFY", "status": "pending", "evidenceRefs": [] },
    { "gateId": "QG-TRUST-REVIEW", "status": "pending", "evidenceRefs": [] }
  ],
  "reviews": [
    { "role": "maintainer", "status": "pending", "evidenceRefs": [] },
    { "role": "trust-reviewer", "status": "pending", "evidenceRefs": [] }
  ],
  "blockers": [],
  "history": [
    {
      "from": null,
      "to": "planned",
      "at": "2026-08-12T10:50:00Z",
      "actor": "davidahmann",
      "reason": "Maintainer authorized one compact post-merge repair for delayed PR #27 P1 route-coverage and P2 assessment-unit findings."
    },
    {
      "from": "planned",
      "to": "in_progress",
      "at": "2026-08-12T10:50:01Z",
      "actor": "implementation-agent",
      "reason": "Compiled both related findings into one bounded offline hotfix task before V1-06."
    },
    {
      "from": "in_progress",
      "to": "accepted",
      "at": "2026-08-12T10:55:28Z",
      "actor": "davidahmann",
      "reason": "Maintainer accepted the exact hotfix after all active command gates passed and candidate-bound local architecture, security, and trust reviews found no unresolved blocker under ADR 0009."
    }
  ]
}
