{
  "$schema": "../../schemas/task-state.schema.json",
  "schemaVersion": "1.0.0",
  "taskId": "V1-07",
  "revision": 5,
  "state": "planned",
  "attempt": 0,
  "candidate": null,
  "criteria": [
    {
      "criterionId": "RECOMMEND-001",
      "status": "pending",
      "evidenceRefs": []
    },
    {
      "criterionId": "RECOMMEND-002",
      "status": "pending",
      "evidenceRefs": []
    },
    {
      "criterionId": "RECOMMEND-003",
      "status": "pending",
      "evidenceRefs": []
    },
    {
      "criterionId": "RECOMMEND-004",
      "status": "pending",
      "evidenceRefs": []
    },
    {
      "criterionId": "RECOMMEND-005",
      "status": "pending",
      "evidenceRefs": []
    },
    {
      "criterionId": "RECOMMEND-006",
      "status": "pending",
      "evidenceRefs": []
    }
  ],
  "gates": [
    {
      "gateId": "QG-REPO-CHECK",
      "status": "pending",
      "evidenceRefs": []
    },
    {
      "gateId": "QG-CONTRACTS",
      "status": "pending",
      "evidenceRefs": []
    },
    {
      "gateId": "QG-SCENARIOS",
      "status": "pending",
      "evidenceRefs": []
    },
    {
      "gateId": "QG-INDEPENDENT-VERIFY",
      "status": "pending",
      "evidenceRefs": []
    },
    {
      "gateId": "QG-TRUST-REVIEW",
      "status": "pending",
      "evidenceRefs": []
    }
  ],
  "reviews": [
    {
      "role": "maintainer",
      "status": "pending",
      "evidenceRefs": []
    },
    {
      "role": "trust-reviewer",
      "status": "pending",
      "evidenceRefs": []
    }
  ],
  "blockers": [],
  "history": [
    {
      "from": null,
      "to": "planned",
      "at": "2026-08-10T00:30:00Z",
      "actor": "planning-agent",
      "reason": "Task created by the canonical OSS V1 plan."
    },
    {
      "from": "planned",
      "to": "planned",
      "at": "2026-08-12T23:30:00Z",
      "actor": "davidahmann",
      "reason": "Required defensible monthly economics, evidence freshness, normalized fallback economics, and separate observed evaluation spend in the recommendation artifact."
    },
    {
      "from": "planned",
      "to": "planned",
      "at": "2026-08-13T00:15:00Z",
      "actor": "davidahmann",
      "reason": "Defined the digest-bound workload freshness clock and added explicit acceptance for complete freshness and gate evidence in recommendation and abstention reports."
    },
    {
      "from": "planned",
      "to": "planned",
      "at": "2026-08-13T00:22:00Z",
      "actor": "davidahmann",
      "reason": "Bound report generation and later authorization to trusted clocks, explicit catalog, evaluation, report, and workload age ceilings, and exact current evidence identities."
    },
    {
      "from": "planned",
      "to": "planned",
      "at": "2026-08-13T00:34:00Z",
      "actor": "davidahmann",
      "reason": "Separated catalog-bound workload projections, observed evaluation spend, and realized field value, and scoped V1-07 to a shared authorization validator whose downstream invocation is accepted separately."
    },
    {
      "from": "planned",
      "to": "planned",
      "at": "2026-08-13T00:43:00Z",
      "actor": "davidahmann",
      "reason": "Bound freshness to current policy and economic-profile digests, immutable fixture content, and a successful catalog-refresh observation while preserving normalized economics for absent optional workload evidence."
    }
  ]
}
